<?xml version="1.0" encoding="utf-8"?>
<Remittance.Advice xmlns:tns="http://www.haad.ae/DataDictionary/CommonTypes" xmlns:xsi="http://www.w3.org/2001/XMLSchema-instance" xsi:noNamespaceSchemaLocation="http://www.haad.ae/DataDictionary/CommonTypes/RemittanceAdvice.xsd">
  <Header>
    <SenderID>T001_Malaffi</SenderID>
    <ReceiverID>TF001_Malaffi</ReceiverID>
    <TransactionDate>{{DATE(DD/MM/YYYY)}} 01:00</TransactionDate>
    <RecordCount>5</RecordCount>
    <DispositionFlag>PRODUCTION</DispositionFlag>
  </Header>
  <Claim>
    <ID>{{VAR(claim_id_one).CUSTOM.generate_claim_id(MF3505)}}</ID>
    <IDPayer>{{VAR(remittance_id_payer).CUSTOM.generate_numbers_id(T001_Malaffi)}}</IDPayer>
	<ProviderID>TF001_Malaffi</ProviderID>
    <DenialCode></DenialCode>
    <PaymentReference>1111155555</PaymentReference>
	<DateSettlement>{{CUSTOM.add_minutes_to_current_date_time(2)}}</DateSettlement>
    <Encounter>
        <FacilityID>MF3505</FacilityID>
    </Encounter>
    <Activity>
          <ID>1</ID>
          <Start>{{CUSTOM.sub_days_to_current_date(60)}} 15:40</Start>
          <Type>5</Type>
          <Code>QD4-C900-16948-01</Code>
          <Quantity>1.0000</Quantity>
          <Net>197590.00</Net>
          <OrderingClinician>GD25888</OrderingClinician>
          <Clinician>GD25888</Clinician>
          <PriorAuthorizationID>MF3505-{{CUSTOM.generate_numbers_id()}}</PriorAuthorizationID>
          <PaymentAmount>197590.00</PaymentAmount>
          <DenialCode></DenialCode>
        </Activity>
  </Claim>
  <Claim>
    <ID>{{VAR(claim_id_two).CUSTOM.generate_claim_id(MF3505)}}</ID>
    <IDPayer>{{VAR(remittance_id_payer).CUSTOM.generate_numbers_id(T001_Malaffi)}}</IDPayer>
	<ProviderID>TF001_Malaffi</ProviderID>
    <DenialCode></DenialCode>
    <PaymentReference>1111155555</PaymentReference>
	<DateSettlement>{{CUSTOM.add_minutes_to_current_date_time(2)}}</DateSettlement>
    <Encounter>
        <FacilityID>MF3505</FacilityID>
    </Encounter>
    <Activity>
          <ID>1</ID>
          <Start>{{CUSTOM.sub_days_to_current_date(60)}} 15:40</Start>
          <Type>5</Type>
          <Code>QD4-C900-16948-01</Code>
          <Quantity>1.0000</Quantity>
          <Net>197590.00</Net>
          <OrderingClinician>GD25888</OrderingClinician>
          <Clinician>GD25888</Clinician>
          <PriorAuthorizationID>MF3505-{{CUSTOM.generate_numbers_id()}}</PriorAuthorizationID>
          <PaymentAmount>197590.00</PaymentAmount>
          <DenialCode></DenialCode>
        </Activity>
  </Claim>
  <Claim>
    <ID>{{VAR(claim_id_three).CUSTOM.generate_claim_id(MF3505)}}</ID>
    <IDPayer>{{VAR(remittance_id_payer).CUSTOM.generate_numbers_id(T001_Malaffi)}}</IDPayer>
	<ProviderID>TF001_Malaffi</ProviderID>
    <DenialCode></DenialCode>
    <PaymentReference>1111155555</PaymentReference>
	<DateSettlement>{{CUSTOM.add_minutes_to_current_date_time(2)}}</DateSettlement>
    <Encounter>
        <FacilityID>MF3505</FacilityID>
    </Encounter>
    <Activity>
          <ID>1</ID>
          <Start>{{CUSTOM.sub_days_to_current_date(60)}} 15:40</Start>
          <Type>5</Type>
          <Code>QD4-C900-16948-01</Code>
          <Quantity>1.0000</Quantity>
          <Net>197590.00</Net>
          <OrderingClinician>GD25888</OrderingClinician>
          <Clinician>GD25888</Clinician>
          <PriorAuthorizationID>MF3505-{{CUSTOM.generate_numbers_id()}}</PriorAuthorizationID>
          <PaymentAmount>197590.00</PaymentAmount>
          <DenialCode></DenialCode>
        </Activity>
  </Claim>
  <Claim>
    <ID>{{VAR(claim_id_four).CUSTOM.generate_claim_id(MF3505)}}</ID>
    <IDPayer>{{VAR(remittance_id_payer).CUSTOM.generate_numbers_id(T001_Malaffi)}}</IDPayer>
	<ProviderID>TF001_Malaffi</ProviderID>
    <DenialCode></DenialCode>
    <PaymentReference>1111155555</PaymentReference>
	<DateSettlement>{{CUSTOM.add_minutes_to_current_date_time(2)}}</DateSettlement>
    <Encounter>
        <FacilityID>MF3505</FacilityID>
    </Encounter>
    <Activity>
          <ID>1</ID>
          <Start>{{CUSTOM.sub_days_to_current_date(60)}} 15:40</Start>
          <Type>5</Type>
          <Code>QD4-C900-16948-01</Code>
          <Quantity>1.0000</Quantity>
          <Net>197590.00</Net>
          <OrderingClinician>GD25888</OrderingClinician>
          <Clinician>GD25888</Clinician>
          <PriorAuthorizationID>MF3505-{{CUSTOM.generate_numbers_id()}}</PriorAuthorizationID>
          <PaymentAmount>197590.00</PaymentAmount>
          <DenialCode></DenialCode>
        </Activity>
  </Claim>
  <Claim>
    <ID>{{VAR(claim_id_five).CUSTOM.generate_claim_id(MF3505)}}</ID>
    <IDPayer>{{VAR(remittance_id_payer).CUSTOM.generate_numbers_id(T001_Malaffi)}}</IDPayer>
	<ProviderID>TF001_Malaffi</ProviderID>
    <DenialCode></DenialCode>
    <PaymentReference>1111155555</PaymentReference>
	<DateSettlement>{{CUSTOM.add_minutes_to_current_date_time(2)}}</DateSettlement>
    <Encounter>
        <FacilityID>MF3505</FacilityID>
    </Encounter>
    <Activity>
          <ID>1</ID>
          <Start>{{CUSTOM.sub_days_to_current_date(60)}} 15:40</Start>
          <Type>5</Type>
          <Code>QD4-C900-16948-01</Code>
          <Quantity>1.0000</Quantity>
          <Net>197590.00</Net>
          <OrderingClinician>GD25888</OrderingClinician>
          <Clinician>GD25888</Clinician>
          <PriorAuthorizationID>MF3505-{{CUSTOM.generate_numbers_id()}}</PriorAuthorizationID>
          <PaymentAmount>197590.00</PaymentAmount>
          <DenialCode></DenialCode>
        </Activity>
  </Claim>
</Remittance.Advice>